{
  "id": "33333333-3333-3333-3333-333333333301",
  "tenant_id": "00000000-0000-0000-0000-0000000000aa",
  "binding_scope": "tenant",
  "binding_type": "material",
  "trade_id": "roofing",
  "source_candidate_type": "material",
  "source_item_key": "shingles_architectural_30yr",
  "source_item_name": null,
  "source_template_key": null,
  "source_template_version": null,
  "source_formula_key": null,
  "source_unit": "square",
  "target_kind": "product_catalog",
  "target_table": "product_catalog",
  "target_item_id": "11111111-1111-1111-1111-111111111111",
  "target_abc_item_number": null,
  "target_unit": "square",
  "unit_conversion_rule": {},
  "pricing_source_type": "catalog_cost",
  "cost_source_type": "catalog",
  "unit_cost": null,
  "labor_rate_id": null,
  "markup_rule_id": null,
  "tax_rule_id": null,
  "effective_from": null,
  "effective_to": null,
  "status": "active",
  "resolver_priority": 100,
  "match_confidence": 1.0,
  "requires_user_confirmation": false,
  "approved_by": null,
  "approved_at": null,
  "deterministic_binding_key": "bpcb|00000000-0000-0000-0000-0000000000aa|roofing|material|shingles_architectural_30yr|-|-|square|product_catalog|product_catalog|11111111-1111-1111-1111-111111111111|-|square",
  "metadata": {
    "_note": "Phase 7.6a contract example. Not live data. Not pushed to estimate. Not a catalog seed."
  }
}