{
  "id": "33333333-3333-3333-3333-333333333301",
  "tenant_id": "00000000-0000-0000-0000-0000000000aa",
  "binding_scope": "tenant",
  "binding_type": "labor",
  "trade_id": "exterior_walls_siding",
  "source_candidate_type": "labor",
  "source_item_key": "labor_install_siding",
  "source_item_name": null,
  "source_template_key": null,
  "source_template_version": null,
  "source_formula_key": null,
  "source_unit": "sqft",
  "target_kind": "labor_rate",
  "target_table": "labor_rates",
  "target_item_id": null,
  "target_abc_item_number": null,
  "target_unit": "sqft",
  "unit_conversion_rule": {},
  "pricing_source_type": "labor_rate",
  "cost_source_type": "labor_rate",
  "unit_cost": null,
  "labor_rate_id": "22222222-2222-2222-2222-222222222222",
  "markup_rule_id": null,
  "tax_rule_id": null,
  "effective_from": null,
  "effective_to": null,
  "status": "active",
  "resolver_priority": 100,
  "match_confidence": 1.0,
  "requires_user_confirmation": false,
  "approved_by": null,
  "approved_at": null,
  "deterministic_binding_key": "bpcb|00000000-0000-0000-0000-0000000000aa|exterior_walls_siding|labor|labor_install_siding|-|-|sqft|labor_rate|labor_rates|-|-|sqft",
  "metadata": {
    "_note": "Phase 7.6a contract example. Not live data. Not pushed to estimate. Not a catalog seed."
  }
}