{
  "id": "33333333-3333-3333-3333-333333333301",
  "tenant_id": "00000000-0000-0000-0000-0000000000aa",
  "binding_scope": "tenant",
  "binding_type": "material",
  "trade_id": "roofing",
  "source_candidate_type": "material",
  "source_item_key": "ridge_vent_premium",
  "source_item_name": null,
  "source_template_key": null,
  "source_template_version": null,
  "source_formula_key": null,
  "source_unit": "square",
  "target_kind": "unresolved",
  "target_table": null,
  "target_item_id": null,
  "target_abc_item_number": null,
  "target_unit": null,
  "unit_conversion_rule": {},
  "pricing_source_type": "unresolved",
  "cost_source_type": "unresolved",
  "unit_cost": null,
  "labor_rate_id": null,
  "markup_rule_id": null,
  "tax_rule_id": null,
  "effective_from": null,
  "effective_to": null,
  "status": "needs_review",
  "resolver_priority": 100,
  "match_confidence": 0.0,
  "requires_user_confirmation": false,
  "approved_by": null,
  "approved_at": null,
  "deterministic_binding_key": "bpcb|00000000-0000-0000-0000-0000000000aa|roofing|material|ridge_vent_premium|-|-|square|unresolved|-|-|-|-",
  "metadata": {
    "_note": "Phase 7.6a contract example. Not live data. Not pushed to estimate. Not a catalog seed."
  }
}